No,pertanyaan,jawaban,,,,
1,Apa itu fakultas di universitas?,Fakultas adalah himpunan sumber daya pendukung yang menyelenggarakan dan mengelola pendidikan akademik; vokasi dan/atau profesi dalam satu atau beberapa bidang ilmu pengetahuan dan teknologi di Universitas.,,,,
1,Jelaskan pengertian fakultas!,Fakultas adalah himpunan sumber daya pendukung yang menyelenggarakan dan mengelola pendidikan akademik; vokasi dan/atau profesi dalam satu atau beberapa bidang ilmu pengetahuan dan teknologi di Universitas.,,,,
1,Fakultas itu maksudnya apa ya?,Fakultas adalah himpunan sumber daya pendukung yang menyelenggarakan dan mengelola pendidikan akademik; vokasi dan/atau profesi dalam satu atau beberapa bidang ilmu pengetahuan dan teknologi di Universitas.,,,,
1,Apa fungsi utama fakultas di kampus?,Fakultas adalah himpunan sumber daya pendukung yang menyelenggarakan dan mengelola pendidikan akademik; vokasi dan/atau profesi dalam satu atau beberapa bidang ilmu pengetahuan dan teknologi di Universitas.,,,,
1, jelaskan apa arti fakultas dalam dunia perkuliahan?,Fakultas adalah himpunan sumber daya pendukung yang menyelenggarakan dan mengelola pendidikan akademik; vokasi dan/atau profesi dalam satu atau beberapa bidang ilmu pengetahuan dan teknologi di Universitas.,,,,
1,Dalam sistem pendidikan tinggi fakultas itu apa?,Fakultas adalah himpunan sumber daya pendukung yang menyelenggarakan dan mengelola pendidikan akademik; vokasi dan/atau profesi dalam satu atau beberapa bidang ilmu pengetahuan dan teknologi di Universitas.,,,,
1,Fakultas dalam lingkungan kampus itu maksudnya apa?,Fakultas adalah himpunan sumber daya pendukung yang menyelenggarakan dan mengelola pendidikan akademik; vokasi dan/atau profesi dalam satu atau beberapa bidang ilmu pengetahuan dan teknologi di Universitas.,,,,
2,Apa itu jurusan atau bagian di universitas?,Jurusan atau Bagian merupakan unit di bawah Fakultas yang mengelola sumber daya akademik dalam lingkup bidang ilmu tertentu.,,,,
2,Jelaskan apa itu jurusan!,Jurusan atau Bagian merupakan unit di bawah Fakultas yang mengelola sumber daya akademik dalam lingkup bidang ilmu tertentu.,,,,
2,Jurusan itu apa ya?,Jurusan atau Bagian merupakan unit di bawah Fakultas yang mengelola sumber daya akademik dalam lingkup bidang ilmu tertentu.,,,,
2,Fungsi jurusan di fakultas apa aja?,Jurusan atau Bagian merupakan unit di bawah Fakultas yang mengelola sumber daya akademik dalam lingkup bidang ilmu tertentu.,,,,
3,Apa itu program studi (prodi)?,Program Studi (prodi) adalah kesatuan kegiatan pendidikan dan pembelajaran yang memiliki kurikulum serta metode tertentu dalam jenis pendidikan akademik; profesi; atau vokasi.,,,,
3,Jelaskan pengertian prodi!,Program Studi (prodi) adalah kesatuan kegiatan pendidikan dan pembelajaran yang memiliki kurikulum serta metode tertentu dalam jenis pendidikan akademik; profesi; atau vokasi.,,,,
3,Prodi itu apa sih?,Program Studi (prodi) adalah kesatuan kegiatan pendidikan dan pembelajaran yang memiliki kurikulum serta metode tertentu dalam jenis pendidikan akademik; profesi; atau vokasi.,,,,
3,Apa yang dimaksud dengan program studi di kampus?,Program Studi (prodi) adalah kesatuan kegiatan pendidikan dan pembelajaran yang memiliki kurikulum serta metode tertentu dalam jenis pendidikan akademik; profesi; atau vokasi.,,,,
4,Apa itu satuan kredit semester (SKS)?,SKS adalah satuan ukuran waktu kegiatan belajar yang dibebankan kepada mahasiswa per minggu per semester dalam berbagai bentuk pembelajaran.,,,,
4,Jelaskan arti SKS dalam perkuliahan!,SKS adalah satuan ukuran waktu kegiatan belajar yang dibebankan kepada mahasiswa per minggu per semester dalam berbagai bentuk pembelajaran.,,,,
4,SKS itu maksudnya apa ya?,SKS adalah satuan ukuran waktu kegiatan belajar yang dibebankan kepada mahasiswa per minggu per semester dalam berbagai bentuk pembelajaran.,,,,
4,Apa fungsi SKS bagi mahasiswa?,SKS adalah satuan ukuran waktu kegiatan belajar yang dibebankan kepada mahasiswa per minggu per semester dalam berbagai bentuk pembelajaran.,,,,
5,Apa itu nilai kredit?,Nilai kredit adalah ukuran beban studi mahasiswa dan beban mengajar dosen yang dinyatakan dalam bentuk SKS.,,,,
5,Jelaskan pengertian nilai kredit dalam kuliah!,Nilai kredit adalah ukuran beban studi mahasiswa dan beban mengajar dosen yang dinyatakan dalam bentuk SKS.,,,,
5,Nilai kredit itu apa sih?,Nilai kredit adalah ukuran beban studi mahasiswa dan beban mengajar dosen yang dinyatakan dalam bentuk SKS.,,,,
5,Apa hubungan antara nilai kredit dan SKS?,Nilai kredit adalah ukuran beban studi mahasiswa dan beban mengajar dosen yang dinyatakan dalam bentuk SKS.,,,,
6,Apa itu Laporan Tugas Akhir (LTA)?,LTA adalah karya tulis ilmiah yang dihasilkan mahasiswa program vokasi sebagai syarat menyelesaikan studi.,,,,
6,Laporan Tugas Akhir itu apa ya?,LTA adalah karya tulis ilmiah yang dihasilkan mahasiswa program vokasi sebagai syarat menyelesaikan studi.,,,,
6,Jelaskan pengertian LTA dalam program vokasi!,LTA adalah karya tulis ilmiah yang dihasilkan mahasiswa program vokasi sebagai syarat menyelesaikan studi.,,,,
6,Apa fungsi LTA bagi mahasiswa vokasi?,LTA adalah karya tulis ilmiah yang dihasilkan mahasiswa program vokasi sebagai syarat menyelesaikan studi.,,,,
7,Apa itu skripsi?,Skripsi adalah karya tulis ilmiah hasil penelitian mahasiswa program sarjana sebagai syarat kelulusan.,,,,
7,Jelaskan apa yang dimaksud skripsi mahasiswa!,Skripsi adalah karya tulis ilmiah hasil penelitian mahasiswa program sarjana sebagai syarat kelulusan.,,,,
7,Skripsi itu tugas akhir apa ya?,Skripsi adalah karya tulis ilmiah hasil penelitian mahasiswa program sarjana sebagai syarat kelulusan.,,,,
7,Kenapa mahasiswa harus buat skripsi?,Skripsi adalah karya tulis ilmiah hasil penelitian mahasiswa program sarjana sebagai syarat kelulusan.,,,,
8,Apa itu tesis?,Tesis adalah karya tulis ilmiah hasil penelitian mahasiswa program magister sebagai syarat penyelesaian studi.,,,,
8,Tesis itu apa ya?,Tesis adalah karya tulis ilmiah hasil penelitian mahasiswa program magister sebagai syarat penyelesaian studi.,,,,
8,Jelaskan pengertian tesis magister!,Tesis adalah karya tulis ilmiah hasil penelitian mahasiswa program magister sebagai syarat penyelesaian studi.,,,,
8,Apa tujuan pembuatan tesis untuk mahasiswa S2?,Tesis adalah karya tulis ilmiah hasil penelitian mahasiswa program magister sebagai syarat penyelesaian studi.,,,,
9,Apa itu disertasi?,Disertasi adalah karya tulis ilmiah hasil penelitian mahasiswa program doktor sebagai syarat kelulusan.,,,,
9,Jelaskan pengertian disertasi!,Disertasi adalah karya tulis ilmiah hasil penelitian mahasiswa program doktor sebagai syarat kelulusan.,,,,
9,Disertasi itu tugas akhir apa ya?,Disertasi adalah karya tulis ilmiah hasil penelitian mahasiswa program doktor sebagai syarat kelulusan.,,,,
9,Apa perbedaan disertasi dengan tesis atau skripsi?,Disertasi adalah karya tulis ilmiah hasil penelitian mahasiswa program doktor sebagai syarat kelulusan.,,,,
10,Apa itu capaian pembelajaran?,Capaian pembelajaran adalah kemampuan yang diperoleh melalui internalisasi pengetahuan; sikap; keterampilan; kompetensi; dan pengalaman kerja.,,,,
10,Jelaskan arti capaian pembelajaran mahasiswa!,Capaian pembelajaran adalah kemampuan yang diperoleh melalui internalisasi pengetahuan; sikap; keterampilan; kompetensi; dan pengalaman kerja.,,,,
10,Capaian pembelajaran itu apa ya maksudnya?,Capaian pembelajaran adalah kemampuan yang diperoleh melalui internalisasi pengetahuan; sikap; keterampilan; kompetensi; dan pengalaman kerja.,,,,
10,Untuk apa capaian pembelajaran ditetapkan?,Capaian pembelajaran adalah kemampuan yang diperoleh melalui internalisasi pengetahuan; sikap; keterampilan; kompetensi; dan pengalaman kerja.,,,,
11,Apa itu ijazah?,Ijazah adalah dokumen resmi yang diberikan kepada lulusan pendidikan akademik atau vokasi sebagai pengakuan atas prestasi belajar dan penyelesaian program studi terakreditasi.,,,,
11,Jelaskan pengertian ijazah!,Ijazah adalah dokumen resmi yang diberikan kepada lulusan pendidikan akademik atau vokasi sebagai pengakuan atas prestasi belajar dan penyelesaian program studi terakreditasi.,,,,
11,Ijazah itu maksudnya apa ya?,Ijazah adalah dokumen resmi yang diberikan kepada lulusan pendidikan akademik atau vokasi sebagai pengakuan atas prestasi belajar dan penyelesaian program studi terakreditasi.,,,,
11,Untuk apa ijazah diberikan kepada mahasiswa?,Ijazah adalah dokumen resmi yang diberikan kepada lulusan pendidikan akademik atau vokasi sebagai pengakuan atas prestasi belajar dan penyelesaian program studi terakreditasi.,,,,
12,Apa itu transkrip akademik?,Transkrip akademik adalah kumpulan nilai mata kuliah yang telah ditempuh mahasiswa selama studi.,,,,
12,Jelaskan pengertian transkrip nilai!,Transkrip akademik adalah kumpulan nilai mata kuliah yang telah ditempuh mahasiswa selama studi.,,,,
12,Transkrip akademik itu apa ya?,Transkrip akademik adalah kumpulan nilai mata kuliah yang telah ditempuh mahasiswa selama studi.,,,,
12,Apa fungsi transkrip akademik bagi lulusan?,Transkrip akademik adalah kumpulan nilai mata kuliah yang telah ditempuh mahasiswa selama studi.,,,,
13,Apa itu SKPI (Surat Keterangan Pendamping Ijazah)?,SKPI adalah dokumen yang memuat informasi tentang pemenuhan kompetensi lulusan dalam suatu program pendidikan tinggi.,,,,
13,Jelaskan pengertian SKPI!,SKPI adalah dokumen yang memuat informasi tentang pemenuhan kompetensi lulusan dalam suatu program pendidikan tinggi.,,,,
13,SKPI itu gunanya apa ya?,SKPI adalah dokumen yang memuat informasi tentang pemenuhan kompetensi lulusan dalam suatu program pendidikan tinggi.,,,,
13,Apa manfaat SKPI bagi mahasiswa setelah lulus?,SKPI adalah dokumen yang memuat informasi tentang pemenuhan kompetensi lulusan dalam suatu program pendidikan tinggi.,,,,
14,Apa itu program Jalur Cepat (Fast Track)?,Program Jalur Cepat adalah program percepatan studi bagi mahasiswa berprestasi untuk menyelesaikan jenjang sarjana dan magister dalam waktu lebih singkat.,,,,
14,Jelaskan pengertian program Fast Track di UNIB!,Program Jalur Cepat adalah program percepatan studi bagi mahasiswa berprestasi untuk menyelesaikan jenjang sarjana dan magister dalam waktu lebih singkat.,,,,
14,Apa tujuan dari program Jalur Cepat?,Program Jalur Cepat adalah program percepatan studi bagi mahasiswa berprestasi untuk menyelesaikan jenjang sarjana dan magister dalam waktu lebih singkat.,,,,
14,Siapa yang bisa ikut program Fast Track?,Program Jalur Cepat adalah program percepatan studi bagi mahasiswa berprestasi untuk menyelesaikan jenjang sarjana dan magister dalam waktu lebih singkat;,,,,
15,Apa itu mata kuliah alternatif?,Mata kuliah alternatif adalah mata kuliah yang dapat diambil mahasiswa di luar program studinya;,,,,
15,Jelaskan pengertian mata kuliah alternatif!,Mata kuliah alternatif adalah mata kuliah yang dapat diambil mahasiswa di luar program studinya;,,,,
15,Mata kuliah alternatif itu maksudnya apa?,Mata kuliah alternatif adalah mata kuliah yang dapat diambil mahasiswa di luar program studinya;,,,,
15,Apakah mahasiswa boleh ambil mata kuliah di luar prodi?,Mata kuliah alternatif adalah mata kuliah yang dapat diambil mahasiswa di luar program studinya;,,,,
16,Apa itu blended learning?,Blended learning adalah metode pembelajaran yang menggabungkan kegiatan tatap muka di kelas dengan pembelajaran daring tanpa mengurangi kualitas pembelajaran;,,,,
16,Jelaskan pengertian blended learning!,Blended learning adalah metode pembelajaran yang menggabungkan kegiatan tatap muka di kelas dengan pembelajaran daring tanpa mengurangi kualitas pembelajaran;,,,,
16,Blended learning itu maksudnya apa ya?,Blended learning adalah metode pembelajaran yang menggabungkan kegiatan tatap muka di kelas dengan pembelajaran daring tanpa mengurangi kualitas pembelajaran;,,,,
16,Bagaimana konsep pembelajaran blended learning di UNIB?,Blended learning adalah metode pembelajaran yang menggabungkan kegiatan tatap muka di kelas dengan pembelajaran daring tanpa mengurangi kualitas pembelajaran;,,,,
17,Apa saja bentuk mata kuliah alternatif di UNIB?,Bentuk pembelajaran mata kuliah alternatif dapat berupa pertukaran mahasiswa; magang; proyek independen; riset; atau kegiatan lain yang ditetapkan oleh program studi;,,,,
17,Jelaskan contoh bentuk mata kuliah alternatif!,Bentuk pembelajaran mata kuliah alternatif dapat berupa pertukaran mahasiswa; magang; proyek independen; riset; atau kegiatan lain yang ditetapkan oleh program studi;,,,,
17,Bentuk mata kuliah alternatif itu apa aja sih?,Bentuk pembelajaran mata kuliah alternatif dapat berupa pertukaran mahasiswa; magang; proyek independen; riset; atau kegiatan lain yang ditetapkan oleh program studi;,,,,
17,Mahasiswa bisa ambil kegiatan apa sebagai mata kuliah alternatif?,Bentuk pembelajaran mata kuliah alternatif dapat berupa pertukaran mahasiswa; magang; proyek independen; riset; atau kegiatan lain yang ditetapkan oleh program studi;,,,,
18,Berapa lama satu SKS pada pembelajaran berupa kuliah?,Satu SKS pada perkuliahan terdiri dari 50 menit tatap muka; 60 menit kegiatan terstruktur; dan 60 menit kegiatan mandiri setiap minggu selama satu semester;,,,,
18,Jelaskan berapa waktu untuk 1 SKS kuliah!,Satu SKS pada perkuliahan terdiri dari 50 menit tatap muka; 60 menit kegiatan terstruktur; dan 60 menit kegiatan mandiri setiap minggu selama satu semester;,,,,
18,Satu SKS kuliah itu berapa jam?,Satu SKS pada perkuliahan terdiri dari 50 menit tatap muka; 60 menit kegiatan terstruktur; dan 60 menit kegiatan mandiri setiap minggu selama satu semester;,,,,
18,Dalam seminggu berapa lama durasi satu SKS kuliah?,Satu SKS pada perkuliahan terdiri dari 50 menit tatap muka; 60 menit kegiatan terstruktur; dan 60 menit kegiatan mandiri setiap minggu selama satu semester;,,,,
19,Berapa lama satu SKS pada pembelajaran praktikum?,Satu SKS pada praktikum atau kerja lapangan setara dengan 170 menit kegiatan setiap minggu selama satu semester;,,,,
19,Jelaskan berapa waktu satu SKS praktikum!,Satu SKS pada praktikum atau kerja lapangan setara dengan 170 menit kegiatan setiap minggu selama satu semester;,,,,
19,Satu SKS praktikum itu berapa jam per minggu?,Satu SKS pada praktikum atau kerja lapangan setara dengan 170 menit kegiatan setiap minggu selama satu semester;,,,,
19,Apa perbedaan waktu antara SKS kuliah dan praktikum?,Satu SKS pada praktikum atau kerja lapangan setara dengan 170 menit kegiatan setiap minggu selama satu semester;,,,,
20,Apa yang dimaksud dengan beban studi mahasiswa?,Beban studi mahasiswa ditentukan berdasarkan kurikulum program studi dengan jumlah SKS yang dapat diambil disesuaikan dengan IP semester sebelumnya;,,,,
20,Jelaskan pengertian beban studi mahasiswa!,Beban studi mahasiswa ditentukan berdasarkan kurikulum program studi dengan jumlah SKS yang dapat diambil disesuaikan dengan IP semester sebelumnya;,,,,
20,Beban studi itu apa ya maksudnya?,Beban studi mahasiswa ditentukan berdasarkan kurikulum program studi dengan jumlah SKS yang dapat diambil disesuaikan dengan IP semester sebelumnya;,,,,
20,Apa yang memengaruhi jumlah SKS yang bisa diambil mahasiswa?,Beban studi mahasiswa ditentukan berdasarkan kurikulum program studi dengan jumlah SKS yang dapat diambil disesuaikan dengan IP semester sebelumnya;,,,,
21,Berapa lama masa kuliah untuk program vokasi diploma tiga?,Program vokasi Diploma Tiga memiliki beban studi - SKS ditempuh minimal dalam 5 semester dan maksimal 10 semester;,,,,
21,Lama kuliah D3 di UNIB berapa semester?,Program vokasi Diploma Tiga memiliki beban studi - SKS ditempuh minimal dalam 5 semester dan maksimal 10 semester;,,,,
21,Berapa SKS dan durasi studi untuk diploma tiga?,Program vokasi Diploma Tiga memiliki beban studi 108-120 SKS ditempuh minimal dalam 5 semester dan maksimal 10 semester;,,,,
21,Berapa lama waktu penyelesaian kuliah D3?,Program vokasi Diploma Tiga memiliki beban studi 108-120 SKS ditempuh minimal dalam 5 semester dan maksimal 10 semester;,,,,
22,Berapa lama masa kuliah untuk program vokasi diploma empat?,Program vokasi Diploma Empat memiliki beban studi 144-160 SKS ditempuh minimal dalam 7 semester dan maksimal 14 semester;,,,,
22,Lama studi untuk D4 berapa semester?,Program vokasi Diploma Empat memiliki beban studi 144-160 SKS ditempuh minimal dalam 7 semester dan maksimal 14 semester;,,,,
22,Berapa total SKS dan durasi kuliah untuk program D4?,Program vokasi Diploma Empat memiliki beban studi 144-160 SKS ditempuh minimal dalam 7 semester dan maksimal 14 semester;,,,,
22,Butuh waktu berapa lama untuk lulus dari D4?,Program vokasi Diploma Empat memiliki beban studi 144-160 SKS ditempuh minimal dalam 7 semester dan maksimal 14 semester;,,,,
23,Berapa lama masa kuliah untuk program sarjana?,Program sarjana memiliki beban studi 144-160 SKS dan dapat ditempuh dalam waktu minimal 7 semester dan maksimal 14 semester;,,,,
23,Lama studi untuk S1 berapa semester?,Program sarjana memiliki beban studi 144-160 SKS dan dapat ditempuh dalam waktu minimal 7 semester dan maksimal 14 semester;,,,,
23,Berapa total SKS dan durasi kuliah untuk sarjana?,Program sarjana memiliki beban studi 144-160 SKS dan dapat ditempuh dalam waktu minimal 7 semester dan maksimal 14 semester;,,,,
23,Kira kira berapa tahun kuliah S1 di UNIB?,Program sarjana memiliki beban studi 144-160 SKS dan dapat ditempuh dalam waktu minimal 7 semester dan maksimal 14 semester;,,,,
24,Bagaimana jika mahasiswa tidak dapat menyelesaikan studi dalam batas waktu maksimal?,Mahasiswa yang tidak dapat menyelesaikan studinya dalam batas waktu maksimal akan dinyatakan Drop Out (DO) berdasarkan Surat Keputusan Rektor;,,,,
24,Apa yang terjadi kalau mahasiswa melebihi batas waktu kuliah?,Mahasiswa yang tidak dapat menyelesaikan studinya dalam batas waktu maksimal akan dinyatakan Drop Out (DO) berdasarkan Surat Keputusan Rektor;,,,,
24,Jika kuliah lebih dari 14 semester apakah masih bisa lanjut?,Mahasiswa yang tidak dapat menyelesaikan studinya dalam batas waktu maksimal akan dinyatakan Drop Out (DO) berdasarkan Surat Keputusan Rektor;,,,,
24,Apakah mahasiswa bisa DO jika terlalu lama kuliah?,Mahasiswa yang tidak dapat menyelesaikan studinya dalam batas waktu maksimal akan dinyatakan Drop Out (DO) berdasarkan Surat Keputusan Rektor;,,,,
25,Mata kuliah apa yang bisa diakui melalui transfer kredit?,Mata kuliah yang bisa ditransfer adalah yang berasal dari program pertukaran mahasiswa; double degree; joint degree atau bentuk kegiatan lain yang diakui oleh universitas;,,,,
25,Jenis mata kuliah apa yang bisa di transfer?,Mata kuliah yang bisa ditransfer adalah yang berasal dari program pertukaran mahasiswa; double degree; joint degree atau bentuk kegiatan lain yang diakui oleh universitas;,,,,
25,Apa saja kegiatan yang bisa dapat pengakuan transfer kredit?,Mata kuliah yang bisa ditransfer adalah yang berasal dari program pertukaran mahasiswa; double degree; joint degree atau bentuk kegiatan lain yang diakui oleh universitas;,,,,
25,Transfer kredit itu berlaku untuk mata kuliah apa aja?,Mata kuliah yang bisa ditransfer adalah yang berasal dari program pertukaran mahasiswa; double degree; joint degree atau bentuk kegiatan lain yang diakui oleh universitas;,,,,
26,Apa syarat mata kuliah yang bisa di transfer kreditkan?,Mata kuliah yang dapat ditransfer harus memiliki kesetaraan materi mendukung capaian pembelajaran dan berasal dari program studi terakreditasi;,,,,
26,Syarat agar mata kuliah bisa diakui lewat transfer kredit apa aja?,Mata kuliah yang dapat ditransfer harus memiliki kesetaraan materi mendukung capaian pembelajaran dan berasal dari program studi terakreditasi;,,,,
26,Mata kuliah bisa di transfer kalau memenuhi apa?,Mata kuliah yang dapat ditransfer harus memiliki kesetaraan materi mendukung capaian pembelajaran dan berasal dari program studi terakreditasi;,,,,
26,Apa ketentuan transfer kredit di UNIB?,Mata kuliah yang dapat ditransfer harus memiliki kesetaraan materi mendukung capaian pembelajaran dan berasal dari program studi terakreditasi;,,,,
27,Berapa jumlah beban studi yang dapat diakui melalui transfer kredit?,Jumlah SKS yang dapat diakui melalui transfer kredit ditetapkan oleh universitas sesuai kesetaraan capaian pembelajaran;,,,,
27,Maksimal berapa SKS yang bisa ditransfer?,Jumlah SKS yang dapat diakui melalui transfer kredit ditetapkan oleh universitas sesuai kesetaraan capaian pembelajaran;,,,,
27,Berapa banyak SKS yang bisa diakui lewat transfer kredit?,Jumlah SKS yang dapat diakui melalui transfer kredit ditetapkan oleh universitas sesuai kesetaraan capaian pembelajaran;,,,,
27,Siapa yang menentukan jumlah SKS hasil transfer kredit?,Jumlah SKS yang dapat diakui melalui transfer kredit ditetapkan oleh universitas sesuai kesetaraan capaian pembelajaran;,,,,
28,Bagaimana prosedur pendaftaran mahasiswa baru?,Pendaftaran mahasiswa dilakukan sesuai jadwal dan ketentuan yang ditetapkan oleh universitas melalui jalur seleksi nasional atau mandiri;,,,,
28,Bagaimana cara daftar kuliah di UNIB?,Pendaftaran mahasiswa dilakukan sesuai jadwal dan ketentuan yang ditetapkan oleh universitas melalui jalur seleksi nasional atau mandiri;,,,,
28,Lewat mana pendaftaran mahasiswa baru dilakukan?,Pendaftaran mahasiswa dilakukan sesuai jadwal dan ketentuan yang ditetapkan oleh universitas melalui jalur seleksi nasional atau mandiri;,,,,
28,Jalur apa saja yang tersedia untuk mendaftar ke UNIB?,Pendaftaran mahasiswa dilakukan sesuai jadwal dan ketentuan yang ditetapkan oleh universitas melalui jalur seleksi nasional atau mandiri;,,,,
29,Apa yang terjadi jika mahasiswa tidak terdaftar selama satu atau dua semester?,Mahasiswa yang tidak melakukan registrasi selama dua semester berturut-turut tanpa izin akan dinyatakan kehilangan statusnya sebagai mahasiswa aktif;,,,,
29,Bagaimana kalau mahasiswa tidak daftar ulang selama dua semester?,Mahasiswa yang tidak melakukan registrasi selama dua semester berturut-turut tanpa izin akan dinyatakan kehilangan statusnya sebagai mahasiswa aktif;,,,,
29,Apakah status mahasiswa hilang kalau tidak registrasi dua semester?,Mahasiswa yang tidak melakukan registrasi selama dua semester berturut-turut tanpa izin akan dinyatakan kehilangan statusnya sebagai mahasiswa aktif;,,,,
29,Apa akibat tidak registrasi ulang di kampus?,Mahasiswa yang tidak melakukan registrasi selama dua semester berturut-turut tanpa izin akan dinyatakan kehilangan statusnya sebagai mahasiswa aktif;,,,,
30,Apa syarat untuk mengajukan cuti akademik?,Mahasiswa dapat mengajukan cuti akademik dengan surat permohonan yang disetujui oleh Ketua Jurusan/Koordinator Prodi dan Dekan serta disahkan oleh Rektor;,,,,
30,Bagaimana cara mengajukan cuti kuliah di UNIB?,Mahasiswa dapat mengajukan cuti akademik dengan surat permohonan yang disetujui oleh Ketua Jurusan/Koordinator Prodi dan Dekan serta disahkan oleh Rektor;,,,,
30,Syarat mahasiswa untuk bisa cuti kuliah apa aja?,Mahasiswa dapat mengajukan cuti akademik dengan surat permohonan yang disetujui oleh Ketua Jurusan/Koordinator Prodi dan Dekan serta disahkan oleh Rektor;,,,,
30,Apakah mahasiswa bisa cuti lebih dari satu semester?,Mahasiswa dapat mengajukan cuti akademik dengan surat permohonan yang disetujui oleh Ketua Jurusan/Koordinator Prodi dan Dekan serta disahkan oleh Rektor;,,,,
31,Setelah cuti berapa jumlah mata kuliah yang bisa diambil mahasiswa?,Setelah masa cuti berakhir mahasiswa dapat mengambil mata kuliah sesuai beban studi maksimal berdasarkan IPS terakhir sebelum cuti;,,,,
31,Setelah cuti mahasiswa boleh ambil berapa SKS?,Setelah masa cuti berakhir mahasiswa dapat mengambil mata kuliah sesuai beban studi maksimal berdasarkan IPS terakhir sebelum cuti;,,,,
31,Berapa batas SKS setelah mahasiswa kembali dari cuti?,Setelah masa cuti berakhir mahasiswa dapat mengambil mata kuliah sesuai beban studi maksimal berdasarkan IPS terakhir sebelum cuti;,,,,
31,Setelah cuti kuliah apakah beban studi mahasiswa dibatasi?,Setelah masa cuti berakhir mahasiswa dapat mengambil mata kuliah sesuai beban studi maksimal berdasarkan IPS terakhir sebelum cuti;,,,,
32,Apa syarat perpindahan antar program studi di lingkungan UNIB?,Mahasiswa dapat pindah antar program studi dalam lingkungan UNIB dengan alasan akademik atau non-akademik yang dapat dipertanggungjawabkan dan mendapat persetujuan dari pimpinan fakultas terkait;,,,,
32,Bagaimana cara pindah prodi di UNIB?,Mahasiswa dapat pindah antar program studi dalam lingkungan UNIB dengan alasan akademik atau non-akademik yang dapat dipertanggungjawabkan dan mendapat persetujuan dari pimpinan fakultas terkait;,,,,
32,Apa saja ketentuan untuk berpindah program studi?,Mahasiswa dapat pindah antar program studi dalam lingkungan UNIB dengan alasan akademik atau non-akademik yang dapat dipertanggungjawabkan dan mendapat persetujuan dari pimpinan fakultas terkait;,,,,
32,Mahasiswa bisa pindah jurusan nggak sih?,Mahasiswa dapat pindah antar program studi dalam lingkungan UNIB dengan alasan akademik atau non-akademik yang dapat dipertanggungjawabkan dan mendapat persetujuan dari pimpinan fakultas terkait;,,,,
33,Berapa beban SKS yang dapat diambil mahasiswa berdasarkan IPS?,Jumlah SKS yang dapat diambil mahasiswa pada semester berikutnya ditentukan berdasarkan Indeks Prestasi Semester (IPS) sebelumnya sesuai aturan akademik universitas;,,,,
33,Banyaknya SKS tergantung dari apa?,Jumlah SKS yang dapat diambil mahasiswa pada semester berikutnya ditentukan berdasarkan Indeks Prestasi Semester (IPS) sebelumnya sesuai aturan akademik universitas;,,,,
33,Apa hubungan IPS dengan jumlah SKS yang bisa diambil?,Jumlah SKS yang dapat diambil mahasiswa pada semester berikutnya ditentukan berdasarkan Indeks Prestasi Semester (IPS) sebelumnya sesuai aturan akademik universitas;,,,,
33,Bagaimana menentukan jumlah SKS yang boleh diambil mahasiswa?,Jumlah SKS yang dapat diambil mahasiswa pada semester berikutnya ditentukan berdasarkan Indeks Prestasi Semester (IPS) sebelumnya sesuai aturan akademik universitas;,,,,
