No,pertanyaan,jawaban,,,,
34,Bagaimana proses pengisian KRS?,Pengisian KRS dilakukan secara daring sesuai jadwal akademik dibimbing dan disetujui oleh dosen pembimbing akademik;,,,,
34,Bagaimana cara isi KRS di UNIB?,Pengisian KRS dilakukan secara daring sesuai jadwal akademik dibimbing dan disetujui oleh dosen pembimbing akademik;,,,,
34,Kapan waktu pengisian KRS dilakukan?,Pengisian KRS dilakukan secara daring sesuai jadwal akademik dibimbing dan disetujui oleh dosen pembimbing akademik;,,,,
34,Siapa yang menyetujui KRS mahasiswa?,Pengisian KRS dilakukan secara daring sesuai jadwal akademik dibimbing dan disetujui oleh dosen pembimbing akademik;,,,,
35,Berapa jumlah SKS untuk mahasiswa semester 1 dan 2?,Pada semester pertama dan kedua jumlah SKS yang diambil mahasiswa mengikuti paket kurikulum yang telah ditentukan oleh program studi;,,,,
35,Mahasiswa semester awal boleh ambil berapa SKS?,Pada semester pertama dan kedua jumlah SKS yang diambil mahasiswa mengikuti paket kurikulum yang telah ditentukan oleh program studi;,,,,
35,Kenapa SKS semester 1 dan 2 itu sudah ditentukan?,Pada semester pertama dan kedua jumlah SKS yang diambil mahasiswa mengikuti paket kurikulum yang telah ditentukan oleh program studi;,,,,
35,Apakah mahasiswa baru boleh ubah paket SKS semester pertama?,Pada semester pertama dan kedua jumlah SKS yang diambil mahasiswa mengikuti paket kurikulum yang telah ditentukan oleh program studi;,,,,
36,Bagaimana jika dosen pembimbing akademik tidak bisa menyetujui KRS?,Jika dosen pembimbing akademik berhalangan persetujuan KRS dapat diberikan oleh pejabat yang ditunjuk oleh Ketua Jurusan atau Koordinator Program Studi;,,,,
36,Kalau dosen PA nggak bisa tanda tangan KRS gimana?,Jika dosen pembimbing akademik berhalangan persetujuan KRS dapat diberikan oleh pejabat yang ditunjuk oleh Ketua Jurusan atau Koordinator Program Studi;,,,,
36,Siapa yang bisa menyetujui KRS kalau PA berhalangan?,Jika dosen pembimbing akademik berhalangan persetujuan KRS dapat diberikan oleh pejabat yang ditunjuk oleh Ketua Jurusan atau Koordinator Program Studi;,,,,
36,Apa solusi kalau KRS belum disetujui pembimbing akademik?,Jika dosen pembimbing akademik berhalangan persetujuan KRS dapat diberikan oleh pejabat yang ditunjuk oleh Ketua Jurusan atau Koordinator Program Studi;,,,,
37,Apa yang terjadi jika mahasiswa lupa mengisi KRS atau tidak disetujui PA?,Mahasiswa yang tidak mengisi KRS atau tidak mendapat persetujuan PA dianggap tidak mengikuti kegiatan akademik pada semester tersebut;,,,,
37,Apa akibat jika mahasiswa tidak isi KRS?,Mahasiswa yang tidak mengisi KRS atau tidak mendapat persetujuan PA dianggap tidak mengikuti kegiatan akademik pada semester tersebut;,,,,
37,Kalau KRS belum disetujui PA apakah tetap bisa kuliah?,Mahasiswa yang tidak mengisi KRS atau tidak mendapat persetujuan PA dianggap tidak mengikuti kegiatan akademik pada semester tersebut;,,,,
37,Lupa isi KRS apa yang harus dilakukan?,Mahasiswa yang tidak mengisi KRS atau tidak mendapat persetujuan PA dianggap tidak mengikuti kegiatan akademik pada semester tersebut;,,,,
38,Apa yang dimaksud dengan perubahan rencana studi?,Perubahan rencana studi adalah proses revisi mata kuliah yang telah diambil dalam KRS karena alasan akademik yang disetujui pembimbing akademik;,,,,
38,Apa itu revisi KRS?,Perubahan rencana studi adalah proses revisi mata kuliah yang telah diambil dalam KRS karena alasan akademik yang disetujui pembimbing akademik;,,,,
38,Kapan mahasiswa boleh ubah rencana studi?,Perubahan rencana studi adalah proses revisi mata kuliah yang telah diambil dalam KRS karena alasan akademik yang disetujui pembimbing akademik;,,,,
38,Kenapa mahasiswa bisa ubah mata kuliah di KRS?,Perubahan rencana studi adalah proses revisi mata kuliah yang telah diambil dalam KRS karena alasan akademik yang disetujui pembimbing akademik;,,,,
39,Kapan perubahan rencana studi bisa dilakukan?,Perubahan rencana studi hanya dapat dilakukan pada waktu yang telah dijadwalkan dalam kalender akademik universitas;,,,,
39,Jadwal ubah KRS dilakukan kapan?,Perubahan rencana studi hanya dapat dilakukan pada waktu yang telah dijadwalkan dalam kalender akademik universitas;,,,,
39,Batas waktu perubahan rencana studi itu kapan?,Perubahan rencana studi hanya dapat dilakukan pada waktu yang telah dijadwalkan dalam kalender akademik universitas;,,,,
39,Apakah bisa ubah KRS di luar jadwal?,Perubahan rencana studi hanya dapat dilakukan pada waktu yang telah dijadwalkan dalam kalender akademik universitas;,,,,
40,Apa itu pembimbing akademik (PA)?,Pembimbing Akademik adalah dosen yang ditugaskan untuk memberikan bimbingan akademik kepada mahasiswa dalam perencanaan studi dan pengembangan karier;,,,,
40,Siapa yang disebut pembimbing akademik di UNIB?,Pembimbing Akademik adalah dosen yang ditugaskan untuk memberikan bimbingan akademik kepada mahasiswa dalam perencanaan studi dan pengembangan karier;,,,,
40,Apa tugas dari pembimbing akademik mahasiswa?,Pembimbing Akademik adalah dosen yang ditugaskan untuk memberikan bimbingan akademik kepada mahasiswa dalam perencanaan studi dan pengembangan karier;,,,,
40,Untuk apa mahasiswa punya pembimbing akademik?,Pembimbing Akademik adalah dosen yang ditugaskan untuk memberikan bimbingan akademik kepada mahasiswa dalam perencanaan studi dan pengembangan karier;,,,,
41,Apa tugas pembimbing akademik?,Pembimbing akademik bertugas membimbing mahasiswa dalam penyusunan rencana studi; memberikan arahan akademik; serta membantu menyelesaikan permasalahan akademik mahasiswa;,,,,
41,Jelaskan peran dosen pembimbing akademik!,Pembimbing akademik bertugas membimbing mahasiswa dalam penyusunan rencana studi; memberikan arahan akademik; serta membantu menyelesaikan permasalahan akademik mahasiswa;,,,,
41,Apa tanggung jawab pembimbing akademik terhadap mahasiswa?,Pembimbing akademik bertugas membimbing mahasiswa dalam penyusunan rencana studi; memberikan arahan akademik; serta membantu menyelesaikan permasalahan akademik mahasiswa;,,,,
41,Pembimbing akademik biasanya bantu mahasiswa dalam hal apa?,Pembimbing akademik bertugas membimbing mahasiswa dalam penyusunan rencana studi; memberikan arahan akademik; serta membantu menyelesaikan permasalahan akademik mahasiswa;,,,,
42,Apa itu KAS (Kuliah Antar Semester)?,Kuliah Antar Semester (KAS) adalah kegiatan perkuliahan yang dilaksanakan di luar jadwal semester reguler untuk mempercepat penyelesaian studi atau memperbaiki nilai;,,,,
42,Jelaskan pengertian kuliah antar semester!,Kuliah Antar Semester (KAS) adalah kegiatan perkuliahan yang dilaksanakan di luar jadwal semester reguler untuk mempercepat penyelesaian studi atau memperbaiki nilai;,,,,
42,KAS itu maksudnya apa ya?,Kuliah Antar Semester (KAS) adalah kegiatan perkuliahan yang dilaksanakan di luar jadwal semester reguler untuk mempercepat penyelesaian studi atau memperbaiki nilai;,,,,
42,Untuk apa kuliah antar semester diselenggarakan?,Kuliah Antar Semester (KAS) adalah kegiatan perkuliahan yang dilaksanakan di luar jadwal semester reguler untuk mempercepat penyelesaian studi atau memperbaiki nilai;,,,,
43,Berapa lama KAS dilaksanakan?,KAS dilaksanakan paling lama selama dua bulan dan menyesuaikan kalender akademik yang ditetapkan universitas;,,,,
43,Durasi pelaksanaan KAS berapa lama?,KAS dilaksanakan paling lama selama dua bulan dan menyesuaikan kalender akademik yang ditetapkan universitas;,,,,
43,Berapa bulan KAS biasanya diadakan?,KAS dilaksanakan paling lama selama dua bulan dan menyesuaikan kalender akademik yang ditetapkan universitas;,,,,
43,KAS berlangsung selama berapa minggu?,KAS dilaksanakan paling lama selama dua bulan dan menyesuaikan kalender akademik yang ditetapkan universitas;,,,,
44,Apa syarat untuk bisa mengikuti KAS?,Mahasiswa dapat mengikuti KAS apabila telah menempuh mata kuliah yang sama sebelumnya dan memperoleh nilai tidak lulus atau ingin memperbaiki nilai;,,,,
44,Syarat ikut kuliah antar semester apa aja?,Mahasiswa dapat mengikuti KAS apabila telah menempuh mata kuliah yang sama sebelumnya dan memperoleh nilai tidak lulus atau ingin memperbaiki nilai;,,,,
44,Mahasiswa yang boleh ikut KAS itu siapa aja?,Mahasiswa dapat mengikuti KAS apabila telah menempuh mata kuliah yang sama sebelumnya dan memperoleh nilai tidak lulus atau ingin memperbaiki nilai;,,,,
44,Apakah KAS hanya untuk yang nilainya jelek?,Mahasiswa dapat mengikuti KAS apabila telah menempuh mata kuliah yang sama sebelumnya dan memperoleh nilai tidak lulus atau ingin memperbaiki nilai;,,,,
45,Berapa SKS yang dapat diambil pada KAS?,Jumlah SKS yang dapat diambil pada kegiatan KAS maksimal 9 SKS;,,,,
45,Mahasiswa boleh ambil berapa SKS saat KAS?,Jumlah SKS yang dapat diambil pada kegiatan KAS maksimal 9 SKS;,,,,
45,Batas maksimum SKS kuliah antar semester berapa?,Jumlah SKS yang dapat diambil pada kegiatan KAS maksimal 9 SKS;,,,,
45,Apakah ada batas SKS untuk KAS?,Jumlah SKS yang dapat diambil pada kegiatan KAS maksimal 9 SKS;,,,,
46,Bagaimana proses pendaftaran KAS?,Pendaftaran KAS dilakukan sesuai jadwal akademik dengan mengisi formulir dan mendapat persetujuan dari dosen pembimbing akademik;,,,,
46,Bagaimana cara daftar kuliah antar semester?,Pendaftaran KAS dilakukan sesuai jadwal akademik dengan mengisi formulir dan mendapat persetujuan dari dosen pembimbing akademik;,,,,
46,Apa langkah-langkah pendaftaran KAS di UNIB?,Pendaftaran KAS dilakukan sesuai jadwal akademik dengan mengisi formulir dan mendapat persetujuan dari dosen pembimbing akademik;,,,,
46,Kapan waktu pendaftaran KAS dibuka?,Pendaftaran KAS dilakukan sesuai jadwal akademik dengan mengisi formulir dan mendapat persetujuan dari dosen pembimbing akademik;,,,,
47,Apa itu kuliah remedial?,Kuliah remedial adalah kegiatan perkuliahan yang diselenggarakan untuk memperbaiki nilai mata kuliah yang belum mencapai standar kelulusan;,,,,
47,Jelaskan pengertian kuliah remedial!,Kuliah remedial adalah kegiatan perkuliahan yang diselenggarakan untuk memperbaiki nilai mata kuliah yang belum mencapai standar kelulusan;,,,,
47,Kuliah remedial itu maksudnya apa ya?,Kuliah remedial adalah kegiatan perkuliahan yang diselenggarakan untuk memperbaiki nilai mata kuliah yang belum mencapai standar kelulusan;,,,,
47,Tujuan dari kuliah remedial itu apa?,Kuliah remedial adalah kegiatan perkuliahan yang diselenggarakan untuk memperbaiki nilai mata kuliah yang belum mencapai standar kelulusan;,,,,
48,Apa itu kuliah tutorial?,Kuliah tutorial adalah kegiatan bimbingan tambahan antara dosen dan mahasiswa untuk memperdalam pemahaman materi kuliah tertentu;,,,,
48,Jelaskan apa yang dimaksud kuliah tutorial!,Kuliah tutorial adalah kegiatan bimbingan tambahan antara dosen dan mahasiswa untuk memperdalam pemahaman materi kuliah tertentu;,,,,
48,Kuliah tutorial itu kegiatan seperti apa?,Kuliah tutorial adalah kegiatan bimbingan tambahan antara dosen dan mahasiswa untuk memperdalam pemahaman materi kuliah tertentu;,,,,
48,Apa perbedaan kuliah tutorial dengan kuliah biasa?,Kuliah tutorial adalah kegiatan bimbingan tambahan antara dosen dan mahasiswa untuk memperdalam pemahaman materi kuliah tertentu;,,,,
49,Dalam kondisi apa mahasiswa dapat mengikuti kuliah remedial?,Mahasiswa dapat mengikuti kuliah remedial jika memperoleh nilai D atau E atau belum mencapai batas kelulusan minimal sesuai ketentuan program studi;,,,,
49,Kapan mahasiswa bisa ikut kuliah remedial?,Mahasiswa dapat mengikuti kuliah remedial jika memperoleh nilai D atau E atau belum mencapai batas kelulusan minimal sesuai ketentuan program studi;,,,,
49,Nilai berapa yang membuat mahasiswa wajib remedial?,Mahasiswa dapat mengikuti kuliah remedial jika memperoleh nilai D atau E atau belum mencapai batas kelulusan minimal sesuai ketentuan program studi;,,,,
49,Apakah boleh remedial jika nilai sudah C?,Mahasiswa dapat mengikuti kuliah remedial jika memperoleh nilai D atau E atau belum mencapai batas kelulusan minimal sesuai ketentuan program studi;,,,,
50,Apa itu kelas internasional?,Kelas internasional adalah program perkuliahan yang menggunakan bahasa asing (biasanya bahasa Inggris) dan melibatkan kerja sama dengan universitas luar negeri;,,,,
50,Jelaskan pengertian kelas internasional di UNIB!,Kelas internasional adalah program perkuliahan yang menggunakan bahasa asing (biasanya bahasa Inggris) dan melibatkan kerja sama dengan universitas luar negeri;,,,,
50,Kelas internasional itu seperti apa?,Kelas internasional adalah program perkuliahan yang menggunakan bahasa asing (biasanya bahasa Inggris) dan melibatkan kerja sama dengan universitas luar negeri;,,,,
50,Apa yang membedakan kelas internasional dengan reguler?,Kelas internasional adalah program perkuliahan yang menggunakan bahasa asing (biasanya bahasa Inggris) dan melibatkan kerja sama dengan universitas luar negeri;,,,,
51,Apa syarat penyelenggaraan kelas internasional?,Kelas internasional dapat diselenggarakan jika program studi memiliki dosen dan sarana pendukung yang memadai serta mendapat izin dari Rektor;,,,,
51,Syarat agar prodi bisa buka kelas internasional apa aja?,Kelas internasional dapat diselenggarakan jika program studi memiliki dosen dan sarana pendukung yang memadai serta mendapat izin dari Rektor;,,,,
51,Apa ketentuan untuk membuka kelas internasional di UNIB?,Kelas internasional dapat diselenggarakan jika program studi memiliki dosen dan sarana pendukung yang memadai serta mendapat izin dari Rektor;,,,,
51,Siapa yang berwenang menetapkan kelas internasional?,Kelas internasional dapat diselenggarakan jika program studi memiliki dosen dan sarana pendukung yang memadai serta mendapat izin dari Rektor;,,,,
52,Apa yang didapat oleh lulusan kelas internasional?,Lulusan kelas internasional akan memperoleh ijazah dan transkrip akademik dalam dua bahasa (Indonesia dan Inggris);,,,,
52,Apa keuntungan ikut kelas internasional?,Lulusan kelas internasional akan memperoleh ijazah dan transkrip akademik dalam dua bahasa (Indonesia dan Inggris);,,,,
52,Lulusan kelas internasional dapat ijazah apa?,Lulusan kelas internasional akan memperoleh ijazah dan transkrip akademik dalam dua bahasa (Indonesia dan Inggris);,,,,
52,Apakah lulusan kelas internasional dapat sertifikat tambahan?,Lulusan kelas internasional akan memperoleh ijazah dan transkrip akademik dalam dua bahasa (Indonesia dan Inggris);,,,,
53,Bagaimana kurikulum kelas internasional diatur?,Kurikulum kelas internasional disusun berdasarkan standar nasional pendidikan tinggi dan kesepakatan kerja sama dengan perguruan tinggi mitra luar negeri;,,,,
53,Apa dasar penyusunan kurikulum kelas internasional?,Kurikulum kelas internasional disusun berdasarkan standar nasional pendidikan tinggi dan kesepakatan kerja sama dengan perguruan tinggi mitra luar negeri;,,,,
53,Kelas internasional pakai kurikulum dari mana?,Kurikulum kelas internasional disusun berdasarkan standar nasional pendidikan tinggi dan kesepakatan kerja sama dengan perguruan tinggi mitra luar negeri;,,,,
53,Siapa yang menetapkan kurikulum kelas internasional?,Kurikulum kelas internasional disusun berdasarkan standar nasional pendidikan tinggi dan kesepakatan kerja sama dengan perguruan tinggi mitra luar negeri;,,,,
54,Bagaimana rentang nilai hasil kuliah dan bobotnya?,Rentang nilai kuliah terdiri dari A (4.00) B (3.00) C (2.00) D (1.00) dan E (0.00) dengan bobot penilaian sesuai pedoman akademik universitas;,,,,
54,Sebutkan rentang nilai dan bobot di UNIB?,Rentang nilai kuliah terdiri dari A (4.00) B (3.00) C (2.00) D (1.00) dan E (0.00) dengan bobot penilaian sesuai pedoman akademik universitas;,,,,
54,Nilai A sampai E punya bobot berapa?,Rentang nilai kuliah terdiri dari A (4.00) B (3.00) C (2.00) D (1.00) dan E (0.00) dengan bobot penilaian sesuai pedoman akademik universitas;,,,,
54,Apa arti nilai D atau E dalam penilaian kuliah?,Rentang nilai kuliah terdiri dari A (4.00) B (3.00) C (2.00) D (1.00) dan E (0.00) dengan bobot penilaian sesuai pedoman akademik universitas;,,,,
55,Apa syarat kehadiran mahasiswa untuk ikut ujian akhir semester?,Mahasiswa dapat mengikuti ujian akhir semester jika memiliki tingkat kehadiran minimal 75% dari total pertemuan kuliah;,,,,
55,Berapa persen kehadiran agar bisa ikut UAS?,Mahasiswa dapat mengikuti ujian akhir semester jika memiliki tingkat kehadiran minimal 75% dari total pertemuan kuliah;,,,,
55,Kalau absen terlalu banyak apakah bisa ikut ujian?,Mahasiswa dapat mengikuti ujian akhir semester jika memiliki tingkat kehadiran minimal 75% dari total pertemuan kuliah;,,,,
55,Kehadiran minimal untuk UAS berapa kali?,Mahasiswa dapat mengikuti ujian akhir semester jika memiliki tingkat kehadiran minimal 75% dari total pertemuan kuliah;,,,,
56,Apa syarat kehadiran dosen untuk dapat melaksanakan ujian akhir semester?,Dosen dapat menyelenggarakan ujian akhir semester jika telah melaksanakan minimal 12 kali tatap muka dalam satu semester;,,,,
56,Dosen harus berapa kali mengajar untuk bisa ujian akhir?,Dosen dapat menyelenggarakan ujian akhir semester jika telah melaksanakan minimal 12 kali tatap muka dalam satu semester;,,,,
56,Kapan dosen boleh menyelenggarakan UAS?,Dosen dapat menyelenggarakan ujian akhir semester jika telah melaksanakan minimal 12 kali tatap muka dalam satu semester;,,,,
56,Syarat pelaksanaan UAS dari sisi dosen apa aja?,Dosen dapat menyelenggarakan ujian akhir semester jika telah melaksanakan minimal 12 kali tatap muka dalam satu semester;,,,,
57,Batas kelulusan mata kuliah berapa?,Mahasiswa dinyatakan lulus mata kuliah jika memperoleh nilai minimal C (setara dengan bobot 2.00);,,,,
57,Nilai minimal untuk lulus mata kuliah berapa?,Mahasiswa dinyatakan lulus mata kuliah jika memperoleh nilai minimal C (setara dengan bobot 2.00);,,,,
57,Lulus mata kuliah itu minimal dapat nilai apa?,Mahasiswa dinyatakan lulus mata kuliah jika memperoleh nilai minimal C (setara dengan bobot 2.00);,,,,
57,Nilai D termasuk lulus atau tidak?,Mahasiswa dinyatakan lulus mata kuliah jika memperoleh nilai minimal C (setara dengan bobot 2.00);,,,,
58,Apa syarat untuk mengikuti ujian susulan?,Ujian susulan dapat diberikan kepada mahasiswa yang berhalangan hadir karena alasan yang sah dan disertai bukti tertulis;,,,,
58,Kapan mahasiswa boleh ikut ujian susulan?,Ujian susulan dapat diberikan kepada mahasiswa yang berhalangan hadir karena alasan yang sah dan disertai bukti tertulis;,,,,
58,Alasan apa yang dibolehkan untuk ikut ujian susulan?,Ujian susulan dapat diberikan kepada mahasiswa yang berhalangan hadir karena alasan yang sah dan disertai bukti tertulis;,,,,
58,Apakah bisa ikut ujian susulan tanpa surat izin?,Ujian susulan dapat diberikan kepada mahasiswa yang berhalangan hadir karena alasan yang sah dan disertai bukti tertulis;,,,,
59,Bagaimana cara memperbaiki nilai mata kuliah?,Mahasiswa dapat memperbaiki nilai dengan mengikuti KAS atau kuliah remedial pada semester berikutnya;,,,,
59,Kalau nilai jelek gimana cara memperbaikinya?,Mahasiswa dapat memperbaiki nilai dengan mengikuti KAS atau kuliah remedial pada semester berikutnya;,,,,
59,Boleh nggak memperbaiki nilai lewat KAS?,Mahasiswa dapat memperbaiki nilai dengan mengikuti KAS atau kuliah remedial pada semester berikutnya;,,,,
59,Bagaimana prosedur perbaikan nilai kuliah di UNIB?,Mahasiswa dapat memperbaiki nilai dengan mengikuti KAS atau kuliah remedial pada semester berikutnya;,,,,
60,Nilai mana yang diakui antara nilai lama dan nilai perbaikan?,Nilai terbaik antara nilai lama dan nilai perbaikan akan digunakan sebagai nilai akhir mahasiswa;,,,,
60,Kalau sudah remedial nilai mana yang dipakai?,Nilai terbaik antara nilai lama dan nilai perbaikan akan digunakan sebagai nilai akhir mahasiswa;,,,,
60,Nilai lama dan nilai perbaikan mana yang berlaku?,Nilai terbaik antara nilai lama dan nilai perbaikan akan digunakan sebagai nilai akhir mahasiswa;,,,,
60,Hasil nilai perbaikan menggantikan nilai lama nggak?,Nilai terbaik antara nilai lama dan nilai perbaikan akan digunakan sebagai nilai akhir mahasiswa;,,,,
61,Apa itu KKN (Kuliah Kerja Nyata)?,KKN adalah kegiatan akademik berbasis pengabdian masyarakat yang wajib diikuti oleh mahasiswa setelah memenuhi ketentuan jumlah SKS tertentu;,,,,
61,Jelaskan pengertian KKN!,KKN adalah kegiatan akademik berbasis pengabdian masyarakat yang wajib diikuti oleh mahasiswa setelah memenuhi ketentuan jumlah SKS tertentu;,,,,
61,KKN itu kegiatan seperti apa ya?,KKN adalah kegiatan akademik berbasis pengabdian masyarakat yang wajib diikuti oleh mahasiswa setelah memenuhi ketentuan jumlah SKS tertentu;,,,,
61,Apa tujuan diadakannya KKN di UNIB?,KKN adalah kegiatan akademik berbasis pengabdian masyarakat yang wajib diikuti oleh mahasiswa setelah memenuhi ketentuan jumlah SKS tertentu;,,,,
62,Apa syarat untuk bisa mengikuti KKN?,Mahasiswa dapat mengikuti KKN setelah menempuh minimal 100 SKS memiliki IPK minimal 2.00 dan memenuhi ketentuan administrasi universitas;,,,,
62,Syarat ikut KKN apa aja?,Mahasiswa dapat mengikuti KKN setelah menempuh minimal 100 SKS memiliki IPK minimal 2.00 dan memenuhi ketentuan administrasi universitas;,,,,
62,Mahasiswa boleh KKN kalau sudah berapa SKS?,Mahasiswa dapat mengikuti KKN setelah menempuh minimal 100 SKS memiliki IPK minimal 2.00 dan memenuhi ketentuan administrasi universitas;,,,,
62,Apa ketentuan akademik sebelum bisa ikut KKN?,Mahasiswa dapat mengikuti KKN setelah menempuh minimal 100 SKS memiliki IPK minimal 2.00 dan memenuhi ketentuan administrasi universitas;,,,,
63,Apa jenis-jenis KKN dan apa syaratnya?,Terdapat dua jenis KKN; KKN Tematik Kontekstual dengan syarat IPK minimal 3.00 dan telah menempuh 100 SKS serta KKN Internasional dengan syarat IPK minimal 3.00 sudah menempuh 100 SKS dan TOEFL ? 450;,,,,
63,Jelaskan perbedaan KKN Tematik dan KKN Internasional!,Terdapat dua jenis KKN; KKN Tematik Kontekstual dengan syarat IPK minimal 3.00 dan telah menempuh 100 SKS serta KKN Internasional dengan syarat IPK minimal 3.00 sudah menempuh 100 SKS dan TOEFL ? 450;,,,,
63,Apa saja syarat untuk KKN Tematik dan KKN Internasional?,Terdapat dua jenis KKN; KKN Tematik Kontekstual dengan syarat IPK minimal 3.00 dan telah menempuh 100 SKS serta KKN Internasional dengan syarat IPK minimal 3.00 sudah menempuh 100 SKS dan TOEFL ? 450;,,,,
63,Bedanya KKN Tematik dan Internasional itu apa ya?,Terdapat dua jenis KKN; KKN Tematik Kontekstual dengan syarat IPK minimal 3.00 dan telah menempuh 100 SKS serta KKN Internasional dengan syarat IPK minimal 3.00 sudah menempuh 100 SKS dan TOEFL ? 450;,,,,
64,Apa itu penyetaraan KKN dan apa syaratnya?,Penyetaraan KKN adalah pengakuan kegiatan setara KKN seperti program MBKM dengan syarat memenuhi durasi capaian pembelajaran dan bukti pelaksanaan yang sah;,,,,
64,Jelaskan apa itu penyetaraan KKN!,Penyetaraan KKN adalah pengakuan kegiatan setara KKN seperti program MBKM dengan syarat memenuhi durasi capaian pembelajaran dan bukti pelaksanaan yang sah;,,,,
64,Program apa saja yang bisa disetarakan dengan KKN?,Penyetaraan KKN adalah pengakuan kegiatan setara KKN seperti program MBKM dengan syarat memenuhi durasi capaian pembelajaran dan bukti pelaksanaan yang sah;,,,,
64,Syarat agar kegiatan bisa disetarakan dengan KKN apa aja?,Penyetaraan KKN adalah pengakuan kegiatan setara KKN seperti program MBKM dengan syarat memenuhi durasi capaian pembelajaran dan bukti pelaksanaan yang sah;,,,,
65,Kuliah apa yang bisa disetarakan dengan KKN?,Kegiatan seperti magang; proyek desa; pengabdian berbasis riset; atau kegiatan MBKM tertentu dapat disetarakan dengan KKN jika memenuhi ketentuan universitas;,,,,
65,Kegiatan MBKM apa yang bisa menggantikan KKN?,Kegiatan seperti magang; proyek desa; pengabdian berbasis riset; atau kegiatan MBKM tertentu dapat disetarakan dengan KKN jika memenuhi ketentuan universitas;,,,,
65,Apakah magang bisa disetarakan dengan KKN?,Kegiatan seperti magang; proyek desa; pengabdian berbasis riset; atau kegiatan MBKM tertentu dapat disetarakan dengan KKN jika memenuhi ketentuan universitas;,,,,
65,Contoh kegiatan pengganti KKN apa aja?,Kegiatan seperti magang; proyek desa; pengabdian berbasis riset; atau kegiatan MBKM tertentu dapat disetarakan dengan KKN jika memenuhi ketentuan universitas;,,,,
66,Apa syarat untuk mengambil Laporan Tugas Akhir (LTA)?,Mahasiswa program vokasi dapat mengambil LTA jika telah menempuh minimal 100 SKS dan memenuhi ketentuan akademik program studi;,,,,
66,Syarat LTA untuk mahasiswa vokasi apa aja?,Mahasiswa program vokasi dapat mengambil LTA jika telah menempuh minimal 100 SKS dan memenuhi ketentuan akademik program studi;,,,,
66,Kapan mahasiswa boleh ambil LTA?,Mahasiswa program vokasi dapat mengambil LTA jika telah menempuh minimal 100 SKS dan memenuhi ketentuan akademik program studi;,,,,
66,Berapa SKS minimal untuk bisa ambil tugas akhir D3/D4?,Mahasiswa program vokasi dapat mengambil LTA jika telah menempuh minimal 100 SKS dan memenuhi ketentuan akademik program studi;,,,,
67,Apa syarat untuk mengambil skripsi?,Mahasiswa sarjana dapat mengambil skripsi setelah menempuh minimal 120 SKS dan memiliki IPK minimal 2.00;,,,,
67,Syarat mengambil skripsi apa aja?,Mahasiswa sarjana dapat mengambil skripsi setelah menempuh minimal 120 SKS dan memiliki IPK minimal 2.00;,,,,
67,Mahasiswa boleh ambil skripsi setelah berapa SKS?,Mahasiswa sarjana dapat mengambil skripsi setelah menempuh minimal 120 SKS dan memiliki IPK minimal 2.00;,,,,
67,Berapa IPK minimal untuk bisa ambil skripsi?,Mahasiswa sarjana dapat mengambil skripsi setelah menempuh minimal 120 SKS dan memiliki IPK minimal 2.00;,,,,
68,Berapa jumlah pembimbing skripsi mahasiswa?,Mahasiswa dibimbing oleh dua orang dosen pembimbing yaitu pembimbing utama dan pembimbing pendamping;,,,,
68,Mahasiswa punya berapa pembimbing skripsi?,Mahasiswa dibimbing oleh dua orang dosen pembimbing yaitu pembimbing utama dan pembimbing pendamping;,,,,
68,Siapa saja yang membimbing skripsi mahasiswa?,Mahasiswa dibimbing oleh dua orang dosen pembimbing yaitu pembimbing utama dan pembimbing pendamping;,,,,
